{
  "documents": [
    {
      "datasheet_identity": "BQ24075 SLUS810",
      "id": "ti-bq24075",
      "manufacturer": "Texas Instruments",
      "pages": [
        {
          "height_points": 792.0,
          "page": 1,
          "render_sha256": "d083e928a3344ac6f7e9707fcab64dae0286671f456c9b86af09a1879103de7b",
          "width_points": 612.0
        },
        {
          "height_points": 792.0,
          "page": 2,
          "render_sha256": "f0744476ba1a79a8bf5116a356fd3dba5f5d51123d389f9c2939809e258e66aa",
          "width_points": 612.0
        },
        {
          "height_points": 792.0,
          "page": 3,
          "render_sha256": "72bdefb64b538049a1af842e8e2136a8988bfddd202900e0fc8532b11be711f8",
          "width_points": 612.0
        },
        {
          "height_points": 792.0,
          "page": 4,
          "render_sha256": "c62ee3da12ba03b130afe99c39540a967e73484669dbd11d6cefb7ecd2b7f259",
          "width_points": 612.0
        },
        {
          "height_points": 792.0,
          "page": 5,
          "render_sha256": "dda65e61dd20ae6567aac4b04a7c5c34aef27f9e556f84fc3b136a9f1c405781",
          "width_points": 612.0
        },
        {
          "height_points": 792.0,
          "page": 6,
          "render_sha256": "f20be7727b974e4229203abbe19a55c4fc44a3a006e7e74f9fa583dd162c9cbd",
          "width_points": 612.0
        },
        {
          "height_points": 792.0,
          "page": 7,
          "render_sha256": "8b95e7488cc9b91234a61683435cc3e378ad5e22fa54d2be1f1ec76807a0dc2e",
          "width_points": 612.0
        },
        {
          "height_points": 792.0,
          "page": 8,
          "render_sha256": "6c16f2e4d782a7a5c751b38550c2fe1e36dafabb69b74c65c6ac4c4efaef3fef",
          "width_points": 612.0
        },
        {
          "height_points": 792.0,
          "page": 9,
          "render_sha256": "b1acccb2ab00096329ac359e79e4127bd579154bd20e648711df87491fa2192a",
          "width_points": 612.0
        },
        {
          "height_points": 792.0,
          "page": 10,
          "render_sha256": "fcbf1bf9b2e0352224f3dd160f345d2715daa6d8f3314fd422133e4ca3222ffb",
          "width_points": 612.0
        },
        {
          "height_points": 792.0,
          "page": 11,
          "render_sha256": "d870a32c17178b30ee5b26822271758578472a3bdc94166243e4fa33166568d6",
          "width_points": 612.0
        },
        {
          "height_points": 792.0,
          "page": 12,
          "render_sha256": "215e91126cdb3a9e07ac6112a8ffdb0183d3ad52df3d03733472426135744fd8",
          "width_points": 612.0
        },
        {
          "height_points": 792.0,
          "page": 13,
          "render_sha256": "c29d2def66e6d79d7dcb99c53b5d9874800d66083670a64cf235fed9117cd761",
          "width_points": 612.0
        },
        {
          "height_points": 792.0,
          "page": 14,
          "render_sha256": "7c31addc00667b3bbf1d68b472729cf5dcfdb3ad5997f816987b8faf4a6bf067",
          "width_points": 612.0
        },
        {
          "height_points": 792.0,
          "page": 15,
          "render_sha256": "45df318dee2e42c74f7834dbd0da4c0d94a1e652177996856730717227d74adb",
          "width_points": 612.0
        },
        {
          "height_points": 792.0,
          "page": 16,
          "render_sha256": "26b89c31d5a24fd1695f1da0d23d0024e4c344450ed80cc139c04803df80caf4",
          "width_points": 612.0
        },
        {
          "height_points": 792.0,
          "page": 17,
          "render_sha256": "7bf4bd0d4b2b13db65ff0d2fe162a834c4b796e5076a8958f4fd238d435b67b9",
          "width_points": 612.0
        },
        {
          "height_points": 792.0,
          "page": 18,
          "render_sha256": "3c8cb23beffa5cb74f063db4938b2f00d1e191b1624b16f76da11e16bed412ed",
          "width_points": 612.0
        },
        {
          "height_points": 792.0,
          "page": 19,
          "render_sha256": "21efc385811cb618646da3886c497a57bb2511ce3f909439bc54f53cf028fef7",
          "width_points": 612.0
        },
        {
          "height_points": 792.0,
          "page": 20,
          "render_sha256": "4bd88f357270b836725aa0700381dbe581e6c87a9df6069f8aec6f93700d5827",
          "width_points": 612.0
        },
        {
          "height_points": 792.0,
          "page": 21,
          "render_sha256": "f231ab68d46b44995cc3500ae3705b12036baf7c4a2a7bd112f287e87d92cb4c",
          "width_points": 612.0
        },
        {
          "height_points": 792.0,
          "page": 22,
          "render_sha256": "c067087f09fd8c94996aae35eec210a811eee2df733546b6ef36755459f07a18",
          "width_points": 612.0
        },
        {
          "height_points": 792.0,
          "page": 23,
          "render_sha256": "8d56ae6a80d9560e280d3a62e99b2d4cf0486f5c5b29d0aa9903e9a308845c75",
          "width_points": 612.0
        },
        {
          "height_points": 792.0,
          "page": 24,
          "render_sha256": "ebca1f137d04a870a76d8b0430841a4f73dd4cd5ed7bad67345298e5b0687bac",
          "width_points": 612.0
        },
        {
          "height_points": 792.0,
          "page": 25,
          "render_sha256": "38c0e23d5440011967745db576b9661f9aef2f139e205360e2a663e4afb62d04",
          "width_points": 612.0
        },
        {
          "height_points": 792.0,
          "page": 26,
          "render_sha256": "362d7e845ef059af39629b11e49a13feba40ea676262ca93185e65d96e45e97f",
          "width_points": 612.0
        },
        {
          "height_points": 792.0,
          "page": 27,
          "render_sha256": "6829a20df3c11149bc52f2ab4009c99c531520fb0193a63f9f7fb0ff00a81566",
          "width_points": 612.0
        },
        {
          "height_points": 792.0,
          "page": 28,
          "render_sha256": "ae2c0dccdf28ca92bdac204d5cc7c89b8b6ba62c024f409c70d9161f99e5b30a",
          "width_points": 612.0
        },
        {
          "height_points": 792.0,
          "page": 29,
          "render_sha256": "8de735f1bcc85da006f7d226c36ca3bc719a5726491c2e62f683cdd6c0c13a01",
          "width_points": 612.0
        },
        {
          "height_points": 792.0,
          "page": 30,
          "render_sha256": "001a38f2c6a543baf689dc6be260094b4723bb14359daaf647ff898584e6ae7a",
          "width_points": 612.0
        },
        {
          "height_points": 792.0,
          "page": 31,
          "render_sha256": "5209e3c56664fc7fdca7e65cbbd09f1377a5ae8c7056649ece65662aaa022157",
          "width_points": 612.0
        },
        {
          "height_points": 792.0,
          "page": 32,
          "render_sha256": "3ec5d1514477e5dcf3bab8c7ba446d2dbca4703e3a41b1d6eb55826e5356dff4",
          "width_points": 612.0
        },
        {
          "height_points": 792.0,
          "page": 33,
          "render_sha256": "c5164755826e5310c4953e3b387d230a42a531513f6458869ebeec848a67d8cb",
          "width_points": 612.0
        },
        {
          "height_points": 792.0,
          "page": 34,
          "render_sha256": "aa8e27e041d3b74f6bef9ad3caf01e8a501e13407410ad28f24bc357478b16e8",
          "width_points": 612.0
        },
        {
          "height_points": 792.0,
          "page": 35,
          "render_sha256": "f0ab2991352f22bd4e14f69719e38502429a648eed34c07b577390afa5f11c66",
          "width_points": 612.0
        },
        {
          "height_points": 792.0,
          "page": 36,
          "render_sha256": "2366717521707b14dca745eefefec579f6f20fb36002c89ad7ccae7d1e1bad08",
          "width_points": 612.0
        },
        {
          "height_points": 792.0,
          "page": 37,
          "render_sha256": "0e3f0a1f57b5cad86d3307fc7aa205ba1369ec0ca24ddaa6b122c366c3302235",
          "width_points": 612.0
        },
        {
          "height_points": 792.0,
          "page": 38,
          "render_sha256": "76f6eb6f20afda843d6c3c5b5bed4dd4b18d7a29a6fe85f5032a254980e3d781",
          "width_points": 612.0
        },
        {
          "height_points": 792.0,
          "page": 39,
          "render_sha256": "25631d059baef21aa2355b53c53588fbac0fe163d44c3701227a7d1a78321bf4",
          "width_points": 612.0
        },
        {
          "height_points": 792.0,
          "page": 40,
          "render_sha256": "1325b893b84bd5a9577db3ce22ad2e6664f7ee9ca2f11494cf6c586dcac52230",
          "width_points": 612.0
        },
        {
          "height_points": 792.0,
          "page": 41,
          "render_sha256": "0edb523be33f7dbf26dbebcd721321519a786a530cb248133508bca0f28d4021",
          "width_points": 612.0
        },
        {
          "height_points": 792.0,
          "page": 42,
          "render_sha256": "33fc2d77e68daafe4f2f14008e7cd1febefce5a567ab1c26d3acbfadbee8bcfd",
          "width_points": 612.0
        },
        {
          "height_points": 792.0,
          "page": 43,
          "render_sha256": "25d4376b47b378a8f0573566d3d68ef1d49be71e6d3237a076eee0b4586614b7",
          "width_points": 612.0
        },
        {
          "height_points": 595.275,
          "page": 44,
          "render_sha256": "339d22b44e229ad4cbc430da03de4c5c0eb5d7b9a9ed3518e6ebc236665920e6",
          "width_points": 841.889
        },
        {
          "height_points": 595.275,
          "page": 45,
          "render_sha256": "7cfa81ebf4abecde8f43f5a9393e9938f981303f19bbef14950658d3d23fd04f",
          "width_points": 841.889
        },
        {
          "height_points": 595.275,
          "page": 46,
          "render_sha256": "092b1f662c906ca1e901362d4d3ce7f540eff8c3baa9f82daec5b7a98f5a057d",
          "width_points": 841.889
        },
        {
          "height_points": 792.283,
          "page": 47,
          "render_sha256": "cc2d73d830f451dd02e730adc0b058ca14299985358b9c18774f8be4d1f5e3a1",
          "width_points": 611.716
        },
        {
          "height_points": 792.283,
          "page": 48,
          "render_sha256": "3ca27d63f76a2072cfd5440cef49ade4571427c2b568749aa5c2f1fde000bf60",
          "width_points": 611.716
        },
        {